id,persona,query,m-claude-sonnet-4-5,m-deepseek-chat,m-gpt-5-mini,m-grok-4-latest,m-gemini-2.5-flash,m-claude-opus-4-5-20251101,m-gpt-5.2-chat-latest,m-deepseek-reasoner,m-gemini-3-pro-preview,m-sonar,m-ai-overview,t-Christmas Toy Donation Programs Near Me,t-Best Places to Drop Off Holiday Gifts for Kids,t-How to Donate New Toys to Children in Need,t-Online Toy Drives for Underprivileged Children,t-Charitable Organizations Supporting Kids' Gifts,t-Impact of Donating Toys to Children's Charities,t-Volunteer Opportunities for Holiday Toy Drives,t-Gift Donation Programs for Low-Income Families,t-Ways to Sponsor a Family for the Holidays,t-Supporting Children on Native American Reservations During Holidays
1233904,"Corporate Partnership Manager","Which national toy donation charities offer corporate partnership programs with employee engagement opportunities?",1,1,1,1,1,1,1,1,1,1,"","X","","","X","","","X","","",""
1233905,"Corporate Partnership Manager","What are the most reputable nonprofit organizations for corporate holiday gift sponsorship with detailed impact reporting?",3,2,3,4,5,3,3,"",1,"","","","","","","","X","","X","X",""
1233906,"Corporate Partnership Manager","Which children's charities have the best infrastructure for handling large-scale corporate toy donations nationwide?",1,2,2,1,1,1,1,1,1,1,2,"","X","X","","X","","","","",""
1233907,"Corporate Partnership Manager","What toy distribution nonprofits offer payroll deduction programs for Fortune 500 employee giving campaigns?",1,1,1,1,1,1,1,1,1,1,3,"X","","","X","X","","","","",""
1233908,"Corporate Partnership Manager","Which holiday giving organizations provide year-round volunteer opportunities for our employees across multiple states?","","",5,"","","","","","","","","","","","","","","X","X","X",""
1233909,"Corporate Partnership Manager","What are the top-rated nonprofits for corporate holiday family sponsorship programs with measurable outcomes?",2,2,3,2,"",2,"",2,"","","","","","","","","X","","X","X",""
1233910,"Corporate Partnership Manager","Which children's toy charities offer corporate recognition opportunities and transparent donation tracking?",1,1,1,1,1,1,1,1,1,1,1,"","","","X","X","X","","","",""
1233911,"Corporate Partnership Manager","What established toy donation organizations serve underserved communities with strong local partnerships?",1,1,1,1,1,1,1,1,1,2,"","X","","","","","","","X","","X"
1233912,"Corporate Partnership Manager","Which nonprofit toy distributors have digital platforms suitable for large corporate giving campaigns?","",1,2,1,1,1,1,1,1,1,7,"","","X","X","X","","","","",""
1233913,"Corporate Partnership Manager","What are the most efficient holiday gift charities for coordinating employee volunteer days during business hours?",5,"","",1,1,"",5,4,"","",3,"X","X","","","","","X","","",""
1233914,"Grandparent Legacy Giver","Which children's charities have the best toy donation programs for Christmas giving?",1,2,1,1,1,1,1,2,2,1,"","X","X","","","","","","","",""
1233915,"Grandparent Legacy Giver","What are the most trusted organizations for donating new toys to underprivileged children?",1,2,1,1,1,1,1,2,1,1,1,"","","X","","","","","X","",""
1233916,"Grandparent Legacy Giver","Which holiday gift charities let me involve my grandchildren in the giving process?",2,2,3,1,1,3,3,"",4,1,"","","","","","","X","X","","",""
1233917,"Grandparent Legacy Giver","What are the best established charities for sponsoring needy families at Christmas?",2,2,3,2,2,2,2,3,4,"","","","","","","","","","X","X",""
1233918,"Grandparent Legacy Giver","Which children's organizations provide detailed reports on how my toy donations are used locally?",1,2,1,1,1,1,2,2,1,2,"","","","","","X","X","","","",""
1233919,"Grandparent Legacy Giver","What reputable charities accept toy donations year-round, not just at Christmas?",7,3,1,"",1,"","","",3,"",3,"","","X","","X","","","","",""
1233920,"Grandparent Legacy Giver","Which organizations help children on reservations receive Christmas gifts and accept check donations?","","",1,4,3,"","","",1,4,"","X","","","","","","","","","X"
1233921,"Grandparent Legacy Giver","What are the most reliable charities for dropping off holiday gifts for disadvantaged children?",1,2,1,1,1,1,2,2,2,1,1,"X","X","","","","","","","",""
1233922,"Grandparent Legacy Giver","Which children's charities offer both online and traditional ways to donate toys for the holidays?",1,2,1,1,1,1,1,2,2,1,"","","","X","X","","","","","",""
1233923,"Grandparent Legacy Giver","What established toy drive organizations have volunteer opportunities for grandparents and grandchildren?",3,2,1,1,2,1,1,2,2,1,"","X","","","","","","X","","",""
1233924,"Military Family Supporter","Which charitable organizations accept toy donations for military children whose parents are deployed overseas during Christmas?",1,2,1,1,1,1,1,1,1,1,3,"X","","X","","","","","","","X"
1233925,"Military Family Supporter","What are the most trusted nonprofits that distribute holiday gifts to Marine Corps families in need?",1,1,1,1,1,1,1,1,1,1,1,"","","","","","X","","X","X",""
1233926,"Military Family Supporter","Which toy drive organizations have the best reputation for supporting military families during PCS moves at Christmas?",1,1,1,1,1,1,1,1,2,1,"","X","","","","X","","X","","",""
1233927,"Military Family Supporter","What charities near Camp Pendleton run Christmas gift programs for children of deployed service members?","",1,2,1,1,2,2,1,2,"","","X","X","","","","","","X","",""
1233928,"Military Family Supporter","Which national nonprofits let military spouses coordinate toy drives for families stationed overseas?",1,1,2,1,1,"",1,1,"",3,"","","","X","X","","","X","","",""
1233929,"Military Family Supporter","What are the top-rated organizations that connect donors with military children who need Christmas presents?",1,2,1,1,1,1,1,1,2,2,3,"","","","X","X","","","","X",""
1233930,"Military Family Supporter","Which toy donation charities show the clearest impact reports for helping military families during holidays?",1,2,1,1,1,1,1,1,1,1,1,"","","","","X","X","","X","",""
1233931,"Military Family Supporter","What reputable nonprofits accept online toy donations specifically for children at remote military bases?",1,2,1,"",1,1,1,3,3,1,1,"X","","X","X","","","","","",""
1233932,"Military Family Supporter","Which holiday gift charities work best with military spouse groups to organize community toy drives?",1,1,1,1,1,1,2,1,1,2,3,"","X","","","","","X","","X",""
1233933,"Military Family Supporter","What established organizations help military families adopt other service families for Christmas gift giving?",1,3,2,1,1,1,"","",5,5,"","","","","","X","","","X","X",""
1233934,"Small Business Community Champion","Which toy donation charities in my area let local businesses serve as collection points for holiday drives?",1,1,1,1,1,1,1,1,1,1,1,"X","X","","","","","","","",""
1233935,"Small Business Community Champion","What are the best children's charities to partner with for our annual Christmas toy drive at our shop?",1,2,1,1,1,1,1,1,2,1,1,"X","","","","","","","X","",""
1233936,"Small Business Community Champion","Which nonprofit organizations help coordinate toy donations between multiple local businesses in our community?",1,1,1,1,1,2,1,1,1,3,"","","","","","X","","X","","",""
1233937,"Small Business Community Champion","Looking for trusted children's charities that provide recognition for business sponsors of holiday gift programs",1,1,1,1,"",1,1,2,1,1,6,"","","","","","X","","","X",""
1233938,"Small Business Community Champion","Which toy donation organizations offer the most flexibility for small business giving throughout the year?",1,1,3,"",1,1,2,4,2,1,"","","","X","","","","","X","",""
1233939,"Small Business Community Champion","What children's charities let customers donate directly at our business location during the holidays?",1,1,1,1,1,1,1,1,1,1,1,"X","X","","","","","","","",""
1233940,"Small Business Community Champion","Which nonprofit toy programs provide the best community impact reporting for business donors like us?",1,1,2,1,1,1,1,1,1,3,"","","","","","X","X","","","",""
1233941,"Small Business Community Champion","Looking for children's gift charities that help us engage our employees in local volunteer opportunities",1,1,1,1,1,1,1,1,2,"","","","","","","","","X","","X",""
1233942,"Small Business Community Champion","Which toy donation organizations focus specifically on helping families right here in our local market area?",1,1,1,1,1,1,1,1,1,2,1,"","","","","","","","X","X",""
1233943,"Small Business Community Champion","What are the top-rated children's charities for small businesses wanting to coordinate holiday giving campaigns?",1,1,1,1,1,1,1,2,1,1,1,"X","","","","X","","","","",""
1233944,"Digital-First Millennial Donor","What are the most trusted online toy donation charities with mobile-friendly donation platforms?",1,1,1,1,1,1,1,1,1,1,1,"","","X","X","","","","","",""
1233945,"Digital-First Millennial Donor","Which holiday gift charities offer automated recurring donations and impact tracking dashboards?",5,"","","",1,2,5,"","","","","","","","","","X","","X","",""
1233946,"Digital-First Millennial Donor","Best national toy drive organizations with virtual participation options and social sharing features?",1,1,1,1,1,1,2,1,2,1,1,"X","","","X","","","","","",""
1233947,"Digital-First Millennial Donor","Which children's gift charities provide the most transparent financial reporting and fund allocation data?",1,2,1,1,"",1,"",2,1,"","","","","","","X","X","","","",""
1233948,"Digital-First Millennial Donor","Top-rated holiday toy charities offering digital gift card donation options instead of physical toys?",1,1,2,1,1,1,1,1,4,"","","","","X","","","","","X","",""
1233949,"Digital-First Millennial Donor","Which family sponsorship organizations have the best mobile apps and real-time donation tracking?","","","","","","","","","","","","","","","X","","","","","X",""
1233950,"Digital-First Millennial Donor","Most innovative toy donation nonprofits with virtual toy drive participation and impact updates?",1,1,1,1,1,2,5,1,4,4,1,"","","","X","","","X","","",""
1233951,"Digital-First Millennial Donor","Which children's gift charities supporting Native American communities offer online donation platforms?",2,"","","","",2,1,"",2,"","","","","","X","","","","","","X"
1233952,"Digital-First Millennial Donor","Best holiday gift organizations with easy online setup for corporate donation matching programs?",5,4,"","",1,"",5,"",4,"","","X","","","","","","","X","",""
1233953,"Digital-First Millennial Donor","Which toy distribution charities send the most detailed digital updates on donation outcomes and impact?",2,2,1,2,1,3,2,1,5,2,"","","","","","X","X","","","",""
1233954,"Suburban Parent Volunteer","What are the best toy donation charities in my area for organizing a neighborhood Christmas drive?",1,2,1,1,1,1,1,2,1,2,1,"X","","","","","","X","","",""
1233955,"Suburban Parent Volunteer","Which children's charities have the most reliable pickup services for large toy donations from our PTA?",1,1,4,1,1,7,"",1,1,"","","","X","X","","","","","","",""
1233956,"Suburban Parent Volunteer","What organizations should I contact to sponsor an entire family's Christmas gifts this year?",3,2,2,2,"","","","","",1,"","","","","","","","","X","X",""
1233957,"Suburban Parent Volunteer","Which toy charities let me see exactly how my donations helped local kids?",1,2,1,1,5,2,5,2,"",2,"","","","","","X","X","","","",""
1233958,"Suburban Parent Volunteer","What are the most trusted national toy donation organizations with strong local chapters?",1,2,1,1,1,1,1,1,1,1,1,"","","","X","X","","","","",""
1233959,"Suburban Parent Volunteer","Which children's charities offer year-round volunteer opportunities beyond just Christmas?",3,"","","","",3,"","","","","","","","","","X","","X","","",""
1233960,"Suburban Parent Volunteer","What toy donation charities work directly with schools and churches in suburban communities?",1,1,1,1,1,2,2,1,5,1,1,"X","","","","","","","X","",""
1233961,"Suburban Parent Volunteer","Which organizations help kids on reservations during the holidays and accept toy donations?",2,5,1,1,"",1,5,"",4,3,"","","","X","","","","","","","X"
1233962,"Suburban Parent Volunteer","What are the best children's gift charities that involve kids in the giving process?",1,2,2,1,1,1,2,3,"","",3,"","","","","","X","X","","",""
1233963,"Suburban Parent Volunteer","Which toy donation organizations have easy online giving platforms for workplace drives?",1,2,1,1,3,1,3,2,3,3,6,"","","X","X","","","","","",""
1233964,"Faith-Based Community Organizer","Which charitable organizations run the most effective Christmas toy drives for families in need in our area?",1,2,1,2,1,2,2,3,4,1,1,"X","X","","","","","","","",""
1233965,"Faith-Based Community Organizer","What are the best nonprofit toy distribution charities that welcome interfaith congregation partnerships?",3,1,1,1,8,1,3,1,2,5,7,"X","","","","X","","","","",""
1233966,"Faith-Based Community Organizer","Which children's gift charities have the strongest track record of transparency and impact reporting?",1,3,"",3,1,1,1,"",3,"","","","","","","X","X","","","",""
1233967,"Faith-Based Community Organizer","What holiday gift programs offer the most volunteer opportunities for our church members to serve together?",3,3,2,3,3,3,3,3,5,"","","","","","","","","X","X","",""
1233968,"Faith-Based Community Organizer","Which toy donation organizations provide the best platforms for organizing large-scale congregation giving campaigns?",1,2,1,1,1,1,1,3,"",1,"","","","X","X","","","","","",""
1233969,"Faith-Based Community Organizer","What are the most reputable children's charities that support Native American families during the holidays?",4,"","","","","","","","",2,5,"","","","","","","","X","","X"
1233970,"Faith-Based Community Organizer","Which gift distribution nonprofits make it easiest for multiple congregations to coordinate joint giving efforts?",4,2,2,3,1,"","",3,"","","","","","","","","","","X","X",""
1233971,"Faith-Based Community Organizer","What toy charity organizations provide the most meaningful feedback about families helped through our donations?",2,2,1,2,1,4,1,2,"",2,1,"","","","","X","X","","","",""
1233972,"Faith-Based Community Organizer","Which children's holiday charities offer year-round giving opportunities beyond just Christmas season?","",1,"","","","","","","","",1,"","","","","X","","","X","",""
1233973,"Faith-Based Community Organizer","What are the top-rated nonprofit organizations for sponsoring entire families during the holiday season?",5,3,5,"","","","",4,"",8,"","","","","","","","","X","X",""